sno,ID,ProdID,Rating,ReviewCount,Category,Brand,Name,ImageURL,Description,Tags
143,51768,618,0,492,"personal, care, oral, care, toothbrushes, electric, toothbrushes, oral, b, electric, toothbrushes","oral, b",Oral-B Floss Action Brush Head,https://i5.walmartimages.com/asr/522783c9-8639-479c-92fe-80eb8c589ed0_1.ade80902b6596a9796c7b89e1c243b91.jpeg | https://i5.walmartimages.com/asr/7444e64e-0404-434a-960a-b6a6196c02ed_1.adbc37eba71fd6964cfc37c63e663be1.jpeg | https://i5.walmartimages.com/asr/41179cee-d34d-4a95-b96b-acf4b749518a_1.b791cd0758d55ffaf3315ff35fc071a7.jpeg | https://i5.walmartimages.com/asr/049c2d9e-9ad6-404a-bab7-b0dac97d6d2d_1.a55a895f913c8934e75a77bf49eec0ce.jpeg | https://i5.walmartimages.com/asr/bf73b192-927c-41d7-9d47-10632f9f9111_1.5f0e6441b621b2257faf9301a7ea5257.jpeg,"brand, dentists, use, headp, g, healthuses, floss, action, brush, head, micropulse, bristles, provide, advanced, cleaning, system, surrounds, tooth, superior, cleaning, oral, b, precision, clean, best, selling, power, refill, smart, technology, features, available, oral, b, triumph, professionalcare, 9000, series, toothbrush, brush, head, hygienically, sealed, convenient, storage, dentists, recommend, changing, toothbrush, 3, months, indicator, bristles, fade, time, signaling, time, change, brush, head, oral, bs, best, brush, professionalcare, handles, fits, triumph, professionalcare, vitality, advancedpower, fit, vitality, sonic, sonic, complete, cross, action, power, brand, dentists, use, headp, g, healthuses, floss, action, brush, head, micropulse, bristles, provide, advanced, cleaning, system, surrounds, tooth, superior, cleaning, oral, b, precision, clean, best, selling, power, refill, smart, technology, features, available, oral, b, triumph, professionalcare, 9000, series, toothbrush, brush, head, hygienically, sealed, convenient, storage, dentists, recommend, changing, toothbrush, 3, months, indicator, bristles, fade, time, signaling, time, change, brush, head, oral, bs, best, brush, professionalcare, handles, fits, triumph, professionalcare, vitality, advancedpower, fit, vitality, sonic, sonic, complete, cross, action, power","personal, care, oral, care, toothbrushes, electric, toothbrushes, oral, b, electric, toothbrushes, oral, b, brand, dentists, use, headp, g, healthuses, floss, action, brush, head, micropulse, bristles, provide, advanced, cleaning, system, surrounds, tooth, superior, cleaning, oral, b, precision, clean, best, selling, power, refill, smart, technology, features, available, oral, b, triumph, professionalcare, 9000, series, toothbrush, brush, head, hygienically, sealed, convenient, storage, dentists, recommend, changing, toothbrush, 3, months, indicator, bristles, fade, time, signaling, time, change, brush, head, oral, bs, best, brush, professionalcare, handles, fits, triumph, professionalcare, vitality, advancedpower, fit, vitality, sonic, sonic, complete, cross, action, power, brand, dentists, use, headp, g, healthuses, floss, action, brush, head, micropulse, bristles, provide, advanced, cleaning, system, surrounds, tooth, superior, cleaning, oral, b, precision, clean, best, selling, power, refill, smart, technology, features, available, oral, b, triumph, professionalcare, 9000, series, toothbrush, brush, head, hygienically, sealed, convenient, storage, dentists, recommend, changing, toothbrush, 3, months, indicator, bristles, fade, time, signaling, time, change, brush, head, oral, bs, best, brush, professionalcare, handles, fits, triumph, professionalcare, vitality, advancedpower, fit, vitality, sonic, sonic, complete, cross, action, power"
144,9,22,0,0,"personal, care, incontinence, incontinence",covidien,Covidien Curity Maternity Pad Heavy 4.33&quot x 12.25&quot (Bag of 14 Pads),https://i5.walmartimages.com/asr/e4e38217-ed43-433f-8ec3-c148ffcfec37_1.ca55e6959f4e1df1eb11bd3b4cfa56d3.jpeg | https://i5.walmartimages.com/asr/28adbe65-1573-48b1-9a61-69f6a06d0777_1.0520d1f47feaec8dd4675b6b757e338b.jpeg,"curity, maternity, pads, x, x, cm, prepackaged, curity, maternity, pad, heavy, x, bag, 14, pads","personal, care, incontinence, incontinence, covidien, curity, maternity, pads, x, x, cm, prepackaged, curity, maternity, pad, heavy, x, bag, 14, pads"
145,7,42,4.3,77,"beauty, beauty, brands, revlon, revlon, lip, balm, conditioner",revlon,Revlon Colorburst Balm Stain - Crush,https://i5.walmartimages.com/asr/3a49f32e-84f9-4cac-81d8-6c6fd80d688e_1.f8b9311bec1a06bd8a1ef3c5e2518bf8.jpeg | https://i5.walmartimages.com/asr/7f6da69b-7ab6-4c5b-936d-a8693383bbb5_1.9cbc0bbbc434edce38d4db8ad58bb48b.jpeg | https://i5.walmartimages.com/asr/905e2d13-3bbd-4c62-ab5b-82072e7ef5d5_1.11b70d26b5416e5c70b18461802e72e6.jpeg | https://i5.walmartimages.com/asr/af39d236-8465-439e-99ff-28aedf7f4d43_1.ae33c44ef01dfd126be41e5564b83743.jpeg,"lightweight, lip, stain, moisturizes, like, balm, weightless, color, wears, evenly, nourishes, lips, sophistication, lightweight, lip, stain, comfort, ease, lip, balm, dry, lips, worries, lip, crayon, infused, moisturizing, shea, mango, coconut, butters, sharpener, required, twist, color, available, 12, shades","beauty, beauty, brands, revlon, revlon, lip, balm, conditioner, revlon, lightweight, lip, stain, moisturizes, like, balm, weightless, color, wears, evenly, nourishes, lips, sophistication, lightweight, lip, stain, comfort, ease, lip, balm, dry, lips, worries, lip, crayon, infused, moisturizing, shea, mango, coconut, butters, sharpener, required, twist, color, available, 12, shades"
146,92592,1,4.3,4,"premium, beauty, premium, hair, care, hair, tools, premium, conditioners",aveda,"Aveda Blue Malva Color Conditioner, 8.5 Oz",https://i5.walmartimages.com/asr/1069af19-f9eb-4dd4-8568-6ade84f7e91d_1.d685e1233d2498e95ebbff8b4c1f7dd0.jpeg | https://i5.walmartimages.com/asr/22bf0505-f127-4e6e-a0f7-44e8dd4b85fd_1.f21ed62b6ad9a051a6667275c8842a69.jpeg | https://i5.walmartimages.com/asr/f78c5f3d-4843-4c13-afe7-06391a0431fa_1.7ad5e5e620333b649888a5d16ee9d820.jpeg,,"premium, beauty, premium, hair, care, hair, tools, premium, conditioners, aveda, "
147,6956489,39,4.7,737,"beauty, skin, care, moisturizers, facial, moisturizers, sensitive, skin",olay,"Olay Complete Daily Moisturizer for Sensitive Skin, SPF 15, 6 fl oz",https://i5.walmartimages.com/asr/f8946948-5c8a-4106-a0bc-a4ea35d0ba84.ed72f85fb9fe6e0d850dddeba569d20f.jpeg | https://i5.walmartimages.com/asr/cfb240a3-e0b7-45b8-8a53-79570245e1d4.83d431c33f8be71b0d965b9ee0c4e337.jpeg | https://i5.walmartimages.com/asr/ce98e6af-c281-4705-aaab-d218c762fbc4.3105386f2a96d39bc6c957d5babd9586.jpeg | https://i5.walmartimages.com/asr/0d5f0abd-5dfd-4e98-b953-316d0f15e115.63be543c4b772ef2e95600a00d315d64.jpeg | https://i5.walmartimages.com/asr/1bafad40-a74d-4cb7-a35e-9557754e78ca.06d3909f71d5249b35d13587d74285aa.jpeg | https://i5.walmartimages.com/asr/2e2b71f4-cea4-4a40-a29a-5986b19ceca0.0eeba5e446bde1ff9209bfd020e3f72f.jpeg | https://i5.walmartimages.com/asr/088d0288-0cac-4377-97f4-4ff80e4d5c6b.b188315b343e0f2c3c17a773721b7da3.jpeg | https://i5.walmartimages.com/asr/b05a59d4-79f5-426b-93b9-ca84ab161fe3.7a60cd383b7d65a8731d5632a0837919.jpeg,"protect, 1, cause, aging, skin, damage, sun, recommended, skin, cancer, foundation, olay, complete, daily, moisturizer, broad, spectrum, sunscreen, spf, 15, facial, moisturizer, uva, uvb, protection, provides, 8, hours, hydration, sensitive, skin, gentle, lightweight, lotion, formulated, vitamin, e, antioxidant, complex, help, protect, skins, surface, damaging, free, radicals, plus, fragrance, free, formula, features, aloe, zinc, oxide, healthy, looking, skin, unlike, facial, moisturizers, sunscreen, complete, day, facial, moisturizer, spf, non, greasy, lightweight, oil, free, formula, leaves, skin, healthy, glow, proven, solasheer, sensitive, technology, experience, hydration, sun, protection, americas, 1, uv, moisturizer, based, p12, m, nielsen, xaoc, unit, sales, olay, complete, lotion, moisturizer, spf, 15, sensitive, oz, gentle, formula, mineral, sunscreen, zinc, oxide, provides, sun, protection, 8, hours, hydration, sensitive, skin, daily, spf, moisturizer, helps, prevent, premature, skin, damage, broad, spectrum, spf, 15, uva, uvb, sunscreen, conditions, skin, surface, aloe, vitamin, e, antioxidant, complex, healthy, looking, skin, oil, free, fragrance, free, non, greasy, dermatologically, tested, non, comedogenic, wo, nt, clog, pores, formula, sensitive, skin, types, nourishes, 7, layers, deep, skins, surface, help, protect, beautiful, younger, looking, skin","beauty, skin, care, moisturizers, facial, moisturizers, sensitive, skin, olay, protect, 1, cause, aging, skin, damage, sun, recommended, skin, cancer, foundation, olay, complete, daily, moisturizer, broad, spectrum, sunscreen, spf, 15, facial, moisturizer, uva, uvb, protection, provides, 8, hours, hydration, sensitive, skin, gentle, lightweight, lotion, formulated, vitamin, e, antioxidant, complex, help, protect, skins, surface, damaging, free, radicals, plus, fragrance, free, formula, features, aloe, zinc, oxide, healthy, looking, skin, unlike, facial, moisturizers, sunscreen, complete, day, facial, moisturizer, spf, non, greasy, lightweight, oil, free, formula, leaves, skin, healthy, glow, proven, solasheer, sensitive, technology, experience, hydration, sun, protection, americas, 1, uv, moisturizer, based, p12, m, nielsen, xaoc, unit, sales, olay, complete, lotion, moisturizer, spf, 15, sensitive, oz, gentle, formula, mineral, sunscreen, zinc, oxide, provides, sun, protection, 8, hours, hydration, sensitive, skin, daily, spf, moisturizer, helps, prevent, premature, skin, damage, broad, spectrum, spf, 15, uva, uvb, sunscreen, conditions, skin, surface, aloe, vitamin, e, antioxidant, complex, healthy, looking, skin, oil, free, fragrance, free, non, greasy, dermatologically, tested, non, comedogenic, wo, nt, clog, pores, formula, sensitive, skin, types, nourishes, 7, layers, deep, skins, surface, help, protect, beautiful, younger, looking, skin"
148,98,185,4.1,306,"beauty, skin, care, moisturizers, facial, moisturizers, anti, aging",garnier,"Garnier SkinActive Ultra-Lift Anti-Aging Eye Cream with Pro-Retinol, 0.5 fl. oz.",https://i5.walmartimages.com/asr/dee635a6-27e5-49b4-bfc8-84b4ebda3d68_1.a5b0225f461f2c7d2fa2b3d5b5d24d64.jpeg | https://i5.walmartimages.com/asr/467b46cb-b6d5-4b30-b5f6-bfc6faf98a18_1.66ef9d44f9a67d59ca492908df444b0d.jpeg | https://i5.walmartimages.com/asr/8c98d4a7-bef4-48a1-8095-29ac0d8500d1_1.45fd20cd156ddb65b9cf28a17c7175d4.jpeg | https://i5.walmartimages.com/asr/6f68283c-87e3-4d91-99fe-9deb794e3a78_1.841cd8fe074fe22d1691ab69692648da.jpeg | https://i5.walmartimages.com/asr/f10194ef-335b-4ae1-ae5b-f21f002ab8c5_1.5f8c4f72df9cdc32586d6e1534cd8434.jpeg | https://i5.walmartimages.com/asr/907d6868-7515-4b23-8437-9c67875f6952_1.f15877549a94e78dcc1d0124418775fd.jpeg | https://i5.walmartimages.com/asr/a0ca66ef-6667-4fba-80af-6d301399f895_1.41b5c1dab0608087ebefa9a5d8f68d3a.jpeg | https://i5.walmartimages.com/asr/07cfb49b-f0ce-4106-a359-576ece08d053_1.1fb467c4915c059c81305775557e0fca.jpeg,"lift, away, signs, aging, start, seeing, visible, results, quickly, multi, tasking, anti, aging, eye, cream, pro, retinol, form, vitamin, caffeine, rice, peptides, deeply, hydrates, brightens, eye, area, reducing, appearance, fine, lines, wrinkles, improves, skin, elasticity, suitable, skin, types, sensitive, skin, best, results, pair, eye, treatment, garnier, skinactives, ultra, lift, range, day, moisturizers, night, creams, serums, eye, cream, pro, retinol, caffeine, antioxidant, complex, vitamin, anti, aging, eye, treatment, reduces, appearance, fine, lines, wrinkles, ultra, lift, anti, wrinkle, eye, cream, deeply, hydrates, improves, elasticity, eye, cream, instantly, hydrates, refreshes, brightens, eye, area","beauty, skin, care, moisturizers, facial, moisturizers, anti, aging, garnier, lift, away, signs, aging, start, seeing, visible, results, quickly, multi, tasking, anti, aging, eye, cream, pro, retinol, form, vitamin, caffeine, rice, peptides, deeply, hydrates, brightens, eye, area, reducing, appearance, fine, lines, wrinkles, improves, skin, elasticity, suitable, skin, types, sensitive, skin, best, results, pair, eye, treatment, garnier, skinactives, ultra, lift, range, day, moisturizers, night, creams, serums, eye, cream, pro, retinol, caffeine, antioxidant, complex, vitamin, anti, aging, eye, treatment, reduces, appearance, fine, lines, wrinkles, ultra, lift, anti, wrinkle, eye, cream, deeply, hydrates, improves, elasticity, eye, cream, instantly, hydrates, refreshes, brightens, eye, area"
149,202,75,5,13,"personal, care, bath, body, body, lotions, creams","clay, park, labs",Clay-Park Labs Ammonium Lactate Lotion 12% 14 oz - (Pack of 3),https://i5.walmartimages.com/asr/b3d5462d-d067-4d6c-9bf4-3208d894d948_1.4d6c2628d4bc49bacda112eafca826ae.jpeg,"pack, 3, upc, 081642525267, pearigo, ammonium, lactate, lotion, 14, oz, moisturizing, softening, dry, scaly, skin, 12, prescription, strength, moisturizing, lotion, extra, dry, rough, skin, lactic, acid, alpha, hydroxy, acid, extremely, effective, natural, skin, moisturizing, agent, clay, park, labs, ammonium, lactate, lotion, 12, 14, oz, pack, 3","personal, care, bath, body, body, lotions, creams, clay, park, labs, pack, 3, upc, 081642525267, pearigo, ammonium, lactate, lotion, 14, oz, moisturizing, softening, dry, scaly, skin, 12, prescription, strength, moisturizing, lotion, extra, dry, rough, skin, lactic, acid, alpha, hydroxy, acid, extremely, effective, natural, skin, moisturizing, agent, clay, park, labs, ammonium, lactate, lotion, 12, 14, oz, pack, 3"
150,167380,0,3.4,14,"beauty, makeup, face, makeup, blush, powder, blush",colors,"L.A. Colors Mineral Blush, Spiced Rum",https://i5.walmartimages.com/asr/e749255f-bde1-4fd3-9390-142b5c0a840c_1.8a97bf0687ccfb805f4c5291f780e9ba.jpeg,"colors, mineral, blush, velvety, formula, long, lasting, wear, ideal, skin, types","beauty, makeup, face, makeup, blush, powder, blush, colors, colors, mineral, blush, velvety, formula, long, lasting, wear, ideal, skin, types"
151,3,789,0,0,"beauty, skin, care, facial, cleansers, exfoliators, facial, scrub","queen, helene","QUEEN HELENE Natural Facial Scrub, Pomegranate & Raspberry 6 oz (Pack of 4)",https://i5.walmartimages.com/asr/4922b7ed-df97-43f4-8b46-2f483551d7cc_1.2ef28fc0e80e260f63441c01cc95e8fd.jpeg,"pack, 4, pack, 4, upc, 079896223077, queen, helene, natural, facial, scrub, pomegranate, raspberry, gently, buffs, away, dull, dead, skin, cells, revealing, fresher, smoother, skin, instantly, skin, types, paraben, free, delicately, fragrant, scrub, combines, raspberry, seeds, natural, exfoliants, ease, away, lifeless, surface, cells, impurities, dull, skin, pomegranate, oil, adds, antioxidant, protection, skin, aging, effects, water, aqua, juglans, regia, walnut, shell, powder, stearic, acid, stearyl, alcohol, glyceryl, stearate, kaolin, sodium, lauryl, sulfate, rubus, idaeus, raspberry, seed, punica, granatum, pomegranate, fruit, extract, dimethicone, cocamidopropyl, betaine, triethanolamine, sorbitol, carbomer, phenoxyethanol, potassium, sorbate, sodium, benzoate, fragrance, red, 33, ci, 17200","beauty, skin, care, facial, cleansers, exfoliators, facial, scrub, queen, helene, pack, 4, pack, 4, upc, 079896223077, queen, helene, natural, facial, scrub, pomegranate, raspberry, gently, buffs, away, dull, dead, skin, cells, revealing, fresher, smoother, skin, instantly, skin, types, paraben, free, delicately, fragrant, scrub, combines, raspberry, seeds, natural, exfoliants, ease, away, lifeless, surface, cells, impurities, dull, skin, pomegranate, oil, adds, antioxidant, protection, skin, aging, effects, water, aqua, juglans, regia, walnut, shell, powder, stearic, acid, stearyl, alcohol, glyceryl, stearate, kaolin, sodium, lauryl, sulfate, rubus, idaeus, raspberry, seed, punica, granatum, pomegranate, fruit, extract, dimethicone, cocamidopropyl, betaine, triethanolamine, sorbitol, carbomer, phenoxyethanol, potassium, sorbate, sodium, benzoate, fragrance, red, 33, ci, 17200"
152,987,6,0,0,"health, superfoods, cleanses, superfoods, acai",tadin,"(3 Pack) Tadin Boldo Herbal Tea (24 Teabags) / Helps Support Kidney, Gallbadder, and Liver",https://i5.walmartimages.com/asr/074ad2ee-562b-4bab-9f64-b8ad73a1d6fe_1.9c1be1c7f99807178f31229543871479.jpeg | https://i5.walmartimages.com/asr/762bd53f-5d74-4245-89ef-f826a836f4f1_1.0418f6da58d0f65cf39c01f2836025ca.jpeg,"boldo, herbal, tea, bags, enjoy, boldo, tea, deserves, live, portrait, health, having, smart, lifestyle, choices, fingertips, makes, picture, perfect, version, easier, achieve, tadins, boldo, tea, practical, way, incorporate, day, tradition, fortitude, millenary, boldo, tree, stands, tall, majestic, andes, mountains, south, america, overflowing, goodness, indigenous, customs, thousands, years, reach, product, features, caffeine, kosher, ksa, quotfind, cup, tea, teapot, tell, hundreds, british, writer, find, instagram, facebook, know, iced, tea, tea, bags, know, use, tea, bags, discover, tea, facts, visit, tadin, herb, tea, vernon, 90058","health, superfoods, cleanses, superfoods, acai, tadin, boldo, herbal, tea, bags, enjoy, boldo, tea, deserves, live, portrait, health, having, smart, lifestyle, choices, fingertips, makes, picture, perfect, version, easier, achieve, tadins, boldo, tea, practical, way, incorporate, day, tradition, fortitude, millenary, boldo, tree, stands, tall, majestic, andes, mountains, south, america, overflowing, goodness, indigenous, customs, thousands, years, reach, product, features, caffeine, kosher, ksa, quotfind, cup, tea, teapot, tell, hundreds, british, writer, find, instagram, facebook, know, iced, tea, tea, bags, know, use, tea, bags, discover, tea, facts, visit, tadin, herb, tea, vernon, 90058"
153,0,6,4.6,7,"home, bedding, bed, sheets, fitted, sheets","unique, bargains",Unique Bargains Satin Silk Fitted Sheet 12&quot Deep Pocket Bottom Sheet,https://i5.walmartimages.com/asr/6eab7660-6bd8-4783-9b4a-2e6f6388bc62_1.0445ad156c602f2ddf3b304d2d75b99e.jpeg | https://i5.walmartimages.com/asr/fc84e680-bd16-42d5-8b50-e115e72c56b5_1.f52b421701f3dc50937986166e7d098e.jpeg | https://i5.walmartimages.com/asr/7f8d4e38-2fc8-4fc9-a038-811b5e8ac538_1.d964dedb849e0e36b357dc186a605349.jpeg | https://i5.walmartimages.com/asr/937d13d8-bb48-4ae8-88d4-404e76951645_1.6a9f024ca6d1f70cd8c2c36a124b3cec.jpeg | https://i5.walmartimages.com/asr/bc36093d-737d-4519-a0d9-a3e68da0eac7_1.a33d9fc99c80d97499db99ddf1e14f48.jpeg | https://i5.walmartimages.com/asr/4ddb8ec8-c25c-44bf-91c8-c88e47e12405_1.e6e61292d034e7fce6984ed74a97dcf3.jpeg | https://i5.walmartimages.com/asr/31521a5a-fb57-4eea-b9bd-1d5ed9328054_1.2fcb731ea968ed445c39a097b0a462fc.jpeg,,"home, bedding, bed, sheets, fitted, sheets, unique, bargains, "
154,4,326,3.5,11,"beauty, travel, size, beauty, travel, size, makeup, travel, size, eye, makeup",shany,"SHANY Indelible Gel Liner - Talc Free - Waterproof, Crease Proof Liner - DARE",https://i5.walmartimages.com/asr/463e349a-9fe7-422d-9e2f-f06461e9f0b1_1.a8773c39fc6b9885d75e730d3ce6130a.jpeg | https://i5.walmartimages.com/asr/7a4a450e-359d-43b1-8c43-650b9b59af37_1.29b88d44cbccf7459e59b86248e8356e.jpeg,"best, defined, eyes, shany, indelible, eye, liners, gel, based, liner, goes, smoothly, professional, precision, luxurious, shades, perfect, skin, tones, ages, rich, long, lasting, formulation, talc, free, water, sweat, proof, eyeliners, set, quickly, day, night, perfect, makeup, enthusiast, indelible, gel, liner, talc, free, dare, talc, free, hypoallergenic, eyeliner, gel, create, professional, precise, lines, definition, quick, dry, lasts, day, night, water, sweat, proof, variety, long, lasting, shades, great, work, play, designed, manufactured, tested, animals, gel, eyeliner, stay, use, makeup, remover, apply, eyeliner, thick, thin, want","beauty, travel, size, beauty, travel, size, makeup, travel, size, eye, makeup, shany, best, defined, eyes, shany, indelible, eye, liners, gel, based, liner, goes, smoothly, professional, precision, luxurious, shades, perfect, skin, tones, ages, rich, long, lasting, formulation, talc, free, water, sweat, proof, eyeliners, set, quickly, day, night, perfect, makeup, enthusiast, indelible, gel, liner, talc, free, dare, talc, free, hypoallergenic, eyeliner, gel, create, professional, precise, lines, definition, quick, dry, lasts, day, night, water, sweat, proof, variety, long, lasting, shades, great, work, play, designed, manufactured, tested, animals, gel, eyeliner, stay, use, makeup, remover, apply, eyeliner, thick, thin, want"
155,344,11,0,63,"personal, care, personal, care, brand, crest",crest,"Crest 3D White Brilliance Mouthwash, Alcohol Free, Mint, 33.8 fl oz",https://i5.walmartimages.com/asr/1fcc5525-9ae3-4c3e-8df9-588d77a7191b_1.b0dba39000cbea3c6bff9ec679eac8c0.jpeg | https://i5.walmartimages.com/asr/27281c8d-15da-4953-8c3b-12eee5d82308_1.efaf2b6ca34292e698daa9f7d8043a0c.jpeg | https://i5.walmartimages.com/asr/74205f38-4b06-4298-a91a-84f924a732f0_2.3f8e2b4dd481f1e5c7bb9feac0799600.jpeg | https://i5.walmartimages.com/asr/73ac4d03-1b96-46b3-875a-3e175957f010_1.2ac3f4cd69b0b86bee8e709cac245fbd.jpeg | https://i5.walmartimages.com/asr/d35fb074-590c-4f49-83f7-ff03046c0e12_1.8678060878702ed21cf65769958c221e.jpeg | https://i5.walmartimages.com/asr/1bd6336d-6f91-4b86-a7e9-ab1433a532bb_1.8b4d1b17110cf8babeb34bcee90a9848.jpeg,"crest, makers, whitestrips, introduce, 3d, white, brilliance, mouthwash, discover, whitening, mouthwash, advanced, whitening, experience, hydrogen, peroxide, alcohol, free, crest, 3d, white, brilliance, whiten, teeth, brushing, removing, surface, stains, satisfied, results, crest, 3d, white, refund, purchase, details, pack, crest, 3d, white, brilliance, mouthwash, alcohol, free, mint, fl, oz, advanced, whitening, experience, peroxide, alcohol, free, whiter, smile, 7, days, brushing, removing, surface, stains, makers, whitestrips, crest, 3d, white, provides, whiter, smile, guaranteed, satisfied, results, crest, 3d, white, refund, purchase, details, pack","personal, care, personal, care, brand, crest, crest, crest, makers, whitestrips, introduce, 3d, white, brilliance, mouthwash, discover, whitening, mouthwash, advanced, whitening, experience, hydrogen, peroxide, alcohol, free, crest, 3d, white, brilliance, whiten, teeth, brushing, removing, surface, stains, satisfied, results, crest, 3d, white, refund, purchase, details, pack, crest, 3d, white, brilliance, mouthwash, alcohol, free, mint, fl, oz, advanced, whitening, experience, peroxide, alcohol, free, whiter, smile, 7, days, brushing, removing, surface, stains, makers, whitestrips, crest, 3d, white, provides, whiter, smile, guaranteed, satisfied, results, crest, 3d, white, refund, purchase, details, pack"
156,90,58,0,0,"premium, beauty, premium, makeup, premium, nail, polish, care, premium, nail, polish",opi,OPI Nail Lacquer Polish .5oz/15mL - This Gown Needs A Crown NL U11,https://i5.walmartimages.com/asr/71caed3f-5f83-404d-8ee6-9d46c76c637a_1.487b59297e0b91218a944a206c798064.jpeg,,"premium, beauty, premium, makeup, premium, nail, polish, care, premium, nail, polish, opi, "
157,9,3,4.4,4546,"beauty, nail, care, nail, polish, sally, hansen, nail, polish","sally, hansen","Sally Hansen Insta-Dri Nail Color, Slick Slate",https://i5.walmartimages.com/asr/42d79922-5d78-44fb-a1bf-8becafeef185_1.f7cb7c48ecef342fee5c51738fece7c3.jpeg | https://i5.walmartimages.com/asr/f5ef69d8-1e1c-42b3-8852-8aaedbbdaffe_1.82cb62c22b29225d267d36b367acd482.jpeg,"color, glides, precisely, quickly, covers, coat, dries, 60, secondsone, stroke, coat, nail, color, covers, coat, brilliantly, perfectionist, brush, contours, nail, color, glides, precisely, quickly, flawlessly, exclusive, flexiglass, complex, combines, beautiful, brilliant, shine, super, strong, wear, simple, dries, 60, seconds","beauty, nail, care, nail, polish, sally, hansen, nail, polish, sally, hansen, color, glides, precisely, quickly, covers, coat, dries, 60, secondsone, stroke, coat, nail, color, covers, coat, brilliantly, perfectionist, brush, contours, nail, color, glides, precisely, quickly, flawlessly, exclusive, flexiglass, complex, combines, beautiful, brilliant, shine, super, strong, wear, simple, dries, 60, seconds"
